{
  "actor": "agent",
  "id": "evt_01J00000000000000000000010",
  "labels": {
    "residency": "global-ok",
    "sensitivity": "internal"
  },
  "payload": {
    "plan_ref": "artifacts/plan.md",
    "steps": [
      {
        "id": "s1",
        "status": "pending",
        "title": "Inspect repo"
      }
    ]
  },
  "provenance": "agent",
  "sid": "ses_01J00000000000000000000000",
  "ts": "2026-07-02T10:00:00.000Z",
  "turn": 1,
  "type": "plan.proposed",
  "v": 1
}
